admission_type_category,Description and Examples
ed,"Admissions originating from home/community that are triaged through ED. Examples: Home, ED (Emergency Department), Law Enforcement, Community, Work"
facility,"Admissions coming from various healthcare facilities providing ongoing or transitional care. Examples: Rehab, SNF (Skilled Nursing Facility), LTACH"
osh,Admissions transferred from outside hospitals. Examples: Other Hospitals
direct,"Direct admissions from outpatient care environments. Examples: Clinics, Physician Offices, Ambulatory Surgery Centers"
elective,"Planned or prescheduled admissions, often for non-emergency procedures. Examples: Prescheduled Surgeries, Planned Admissions (such as induced baby delivery)"
other,Admissions from undefined or less typical sources. Examples: Unknown Sources